{
  "schema_version": "2.0",
  "case_id": "case-0001",
  "status": "draft",
  "category": "answerable",
  "query": "Покажи фактическую численность моей команды по грейдам. Верни по одной строке на каждый грейд. Используй все доступные грейды и не делай пропусков грейдов.",
  "source_type": "basket",
  "source_business_process": "Family 5 — Анализ команды",
  "employee_id": 1599763,
  "employee_role": "manager",
  "snapshot_id": "heimdall-sandbox@6ad3901a05d2ae82",
  "skill_registry_hash": "sha256:4f53cda18c2baa0c0354bb5f9a3ecbe5ed12ab4d8e11ba873c2f11161202b945",
  "expected_skills": [
    "headcount_by_dimension"
  ],
  "gold_contract": {
    "$ref": "../templates/gold_contract.schema.json",
    "properties": {
      "rows": {
        "type": "array",
        "description": "Строки результата: при outcome=answer верни по одной строке на каждый грейд в выбранной команде. Грейды не должны повторяться; порядок строк не важен. Область команды определяй по запросу пользователя и доступным ему данным. При остальных outcome верни пустой массив.",
        "items": {
          "type": "object",
          "additionalProperties": false,
          "required": [
            "grade",
            "employee_count"
          ],
          "properties": {
            "grade": {
              "type": "integer"
            },
            "employee_count": {
              "type": "integer",
              "minimum": 0
            }
          }
        }
      }
    }
  },
  "gold_answer": {
    "outcome": "answer",
    "rows": [
      {
        "grade": 7,
        "employee_count": 1
      },
      {
        "grade": 8,
        "employee_count": 1
      },
      {
        "grade": 9,
        "employee_count": 3
      },
      {
        "grade": 10,
        "employee_count": 2
      },
      {
        "grade": 11,
        "employee_count": 1
      },
      {
        "grade": 12,
        "employee_count": 0
      },
      {
        "grade": 13,
        "employee_count": 1
      },
      {
        "grade": 14,
        "employee_count": 1
      },
      {
        "grade": 15,
        "employee_count": 0
      }
    ],
    "comments": "Команда определена как прямые линейные подчинённые: руководитель — Панкратова Маргарита Всеволодовна (person_id e43d1ab4-61a3-4dc8-ab26-9a55eb6f863c), фильтр по табельному номеру в oshs_director_employee_id; счёт — метрика fact_count (фактическая численность), итого 10 человек. Грейд 15 присутствует с нулевым счётом: есть один подчинённый этого грейда вне фактической численности. Если под командой иметь в виду всё дерево подчинённых (oshs_director_hierarchy_employee_id) или agile-структуру, цифры будут другими."
  },
  "gold_comparison": {
    "template": "simple_comparison",
    "row_key": [
      "grade"
    ]
  }
}
